"DH2MQXRU","journalArticle","2024","Madziwa, E","Advancing honour and dignity in death for victims of armed conflicts: Exploring the challenges and opportunities of AI and machine learning in humanitarian forensic action under IHL","INTERNATIONAL REVIEW OF THE RED CROSS","","1816-3831","10.1017/S181638312400033X","","With technological developments presenting tremendous opportunities, rapid developments in data-driven artificial intelligence (AI) and machine learning (ML) have the potential to significantly transform humanitarian forensic action. Yet, their role in the forensic identification of dead bodies remains unexamined. The correct and early identification of dead bodies is not only important to afford the deceased their honour and dignity and to ensure that their families know the fate of their loved ones, but also has broader implications for human rights and international humanitarian law (IHL). This article examines the opportunities and challenges of AI and ML in advancing honour and dignity in death for armed conflict victims in humanitarian forensic action under IHL. It argues that the application of AI and ML in humanitarian forensic action has the potential to revolutionize and support forensic practitioners in the identification of human remains. This will consequently guarantee that families know the fate of their loved ones and that the deceased are afforded dignified burials according to their religious and cultural rites. The article proposes recommendations for the future use of AI and ML in humanitarian forensic action, including the adoption of a legally binding international instrument governing their use, the development of guidelines for their use, the training of forensic actors in IHL and human rights law, and the use of new technologies in humanitarian action.","2024-09-27","2024-10-27 16:13:27","2024-10-27 16:13:27","","","","","","","","","","","","","","","English","","","","WOS:001320482700001","","","","","","","LAW; machine learning; artificial intelligence; human rights; HUMAN-RIGHTS; humanitarian forensic action; WAR DEAD","","","","","","","","","","","","","","","","","","","","","","","","","","","","","","","","","","","","","","","","","","","","","","",""
"5ASHR3ER","journalArticle","2023","Blackham, A","SETTING THE FRAMEWORK FOR ACCOUNTABILITY FOR ALGORITHMIC DISCRIMINATION AT WORK","MELBOURNE UNIVERSITY LAW REVIEW","","0025-8938","","","Algorithmic discrimination represents a growing challenge for equality law. While the elimination of discrimination in employment and occupation is a fundamental obligation of International Labour Organization members, Australian equality law remains ill-adapted to respond to emerging risks. This article argues that the automated application of machine learning algorithms presents five critical challenges to equality law related to the scale of data used; their speed and scale of application; lack of transparency; growth in employer control; and the complex supply chain associated with digital technologies. Considering principles from privacy and data protection law, third -party and accessorial liability, and collective solutions, this article puts forward reforms and suggestions to better set the framework for accountability for algorithmic discrimination in the workplace.","2023","2024-10-27 16:13:27","2024-10-27 16:13:27","","63-113","","1","47","","","","","","","","","","English","","","","WOS:001111483100005","","","","","","","LAW; EQUALITY; AGE; PRIVACY","","","","","","","","","","","","","","","","","","","","","","","","","","","","","","","","","","","","","","","","","","","","","","",""
"M835Y5YV","journalArticle","2023","Adams-Prassl, J; Binns, R; Kelly-Lyth, A","Directly Discriminatory Algorithms","MODERN LAW REVIEW","","0026-7961","10.1111/1468-2230.12759","","Discriminatory bias in algorithmic systems is widely documented. How should the law respond? A broad consensus suggests approaching the issue principally through the lens of indirect discrimination, focusing on algorithmic systems' impact. In this article, we set out to challenge this analysis, arguing that while indirect discrimination law has an important role to play, a narrow em on this regime in the context of machine learning algorithms is both normatively undesirable and legally flawed. We illustrate how certain forms of algorithmic bias in frequently deployed algorithms might constitute direct discrimination, and explore the ramifications-both in practical terms, and the broader challenges automated decision-making systems pose to the conceptual apparatus of anti-discrimination law.","2023-01","2024-10-27 16:13:27","2024-10-27 16:13:27","","144-175","","1","86","","","","","","","","","","English","","","","WOS:000834063200001","","","","","","","FAIRNESS","","","","","","","","","","","","","","","","","","","","","","","","","","","","","","","","","","","","","","","","","","","","","","",""
"4JWXK9Y9","journalArticle","2024","Walker-Munro, B","Can Autonomous Weapon Systems be Seized? Interactions with the Law of Prize and War Booty","JOURNAL OF CONFLICT & SECURITY LAW","","1467-7954","10.1093/jcsl/krad016","","The military has often been used as a proving ground for advances in technology. With the advent of machine learning, algorithms and artificial intelligence, there has been a slew of scholarship around the legal and ethical challenges of applying those technologies to the military. Nowhere has the debate been fiercer than in examining whether international law is resilient enough to impose individual and State responsibility for the misuse of these autonomous weapon systems (AWSs). However, by introducing increasing levels of electronic and digital components into weapon systems, States are also introducing opportunities for adversaries to hack, suborn or take over AWSs in a manner unthinkable compared to conventional weaponry. Yet, no academic discussion has considered how the law of prize and war booty might apply to AWSs that are captured in such a way. This article seeks to address this gap.","2024-04-27","2024-10-27 16:13:27","2024-10-27 16:13:27","","143-163","","1","29","","","","","","","","","","English","","","","WOS:001137078400001","","","","","","","CAPTURE; COURTS; KILL; POWER","","","","","","","","","","","","","","","","","","","","","","","","","","","","","","","","","","","","","","","","","","","","","","",""
"E8WA542H","conferencePaper","2022","Rudzite, L; Kelli, A; UNIV LATVIA PRESS","THE INTERACTION BETWEEN ALGORITHMIC TRANSPARENCY AND LEGALITY: PERSONAL DATA PROTECTION AND PATENT LAW PERSPECTIVES","University of Tartu","978-9934-18-825-1","","10.22364/iscflul.8.2.27","","Artificial Intelligence and its sub-field Machine Learning in the European Union has been directed as one of the political priorities towards the augmentation of human prosperity. However, due to its characteristics, for instance, the ""black-box"" problem, AI may pose challenges within the existing legal framework. The article focuses on analysing the legality of algorithmic transparency in two fields in the EU-data protection (obligation to provide information to the data subject) and under the criteria of ""sufficient disclosure"" of the patent legal framework - to improve legal clarity concerning the issue.","2022","2024-10-27 16:13:27","2024-10-27 16:13:27","","400-408","","","","","","","","","","","","","English","","","","WOS:001070845700027","","","","","","","artificial intelligence; patent; transparency; data protection","","","","","","","","","","","","","","","","","","","","","","","","","","","","","","","","NEW LEGAL REALITY: CHALLENGES AND PERSPECTIVES. II","","","","","","","","","","","","","","",""
"N65HZHBK","conferencePaper","2022","Kesari, A; ACM","The Privacy-Fairness-Accuracy Frontier: A Computational Law & Economics Toolkit for Making Algorithmic Tradeoffs","New York University","978-1-4503-9234-1","","10.1145/3511265.3550437","","Both law and computer science are concerned with developing frameworks for protecting privacy and ensuring fairness. Both fields often consider these two values separately and develop legal doctrines and machine learning metrics in isolation from one another. Yet, privacy and fairness values can conflict, especially when considered alongside the accuracy of an algorithm. The computer science literature often treats this problem as an ""impossibility theorem"" - we can have privacy or fairness but not both. Legal doctrine is similarly constrained by a focus on the inputs to a decision - did the decisionmaker intend to use information about protected attributes. Despite these challenges, there is a way forward. The law has integrated economic frameworks to consider tradeoffs in other domains, and a similar approach can clarify policymakers' thinking around balancing accuracy, privacy, and fairnesss. This piece illustrates this idea by using a law & economics lens to formalize the notion of a Privacy-Fairness-Accuracy frontier, and demonstrating this framework on a consumer lending dataset. An open-source Python software library and GUI will be made available.","2022","2024-10-27 16:13:27","2024-10-27 16:13:27","","77-85","","","","","","","","","","","","","English","","","","WOS:001074472400008","","","","","","","privacy; consumer protection; fairness","","","","","","","","","","","","","","","","","","","","","","","","","","","","","","","","PROCEEDINGS OF THE 2022 SYMPOSIUM ON COMPUTER SCIENCE AND LAW, CSLAW 2022","","","","","","","","","","","","","","",""
"PEDX3VIC","journalArticle","2024","López, JBG","Goals, Effects and Challenges of the Financial Transaction Tax : A Comparative Law Study in France, Italy and Spain","REVIEW OF EUROPEAN AND COMPARATIVE LAW","","2545-384X","10.31743/recl.17435","","The Preamble of the Spanish Financial Transactions Tax Law establishes that ""[t]he shaping of the tax follows the line taken by our neighbouring countries, including France and Italy, thus contributing to greater coordination of these taxes across Europe."" In this sense, the Spanish tax shows important similarities with those established in France and Italy in relation to the levy on the acquisition of certain shares and securities representing the capital of a company for consideration. Nevertheless, both the French and the Italian taxes apply to other types of transactions, not covered by the Spanish Law, which is why it is necessary to carry out the corresponding comparative study. Furthermore, the effects that have arisen from the application of this kind of taxes to financial transactions merited a proper analysis in order to determine if the main goals pursued by these taxes have been achieved in an efficient way. In any case, there are emerging tax challenges in financial markets connected, on the one hand, to the use of crypto-assets and distributed ledger technology, and, on the other hand, to the implementation of artificial intelligence and machine learning and the fair taxation of these operations.","2024-09-30","2024-10-27 16:13:27","2024-10-27 16:13:27","","","","","","","","","","","","","","","English","","","","WOS:001328348000001","","","","","","","artificial intelligence; distributed ledger technology; financial transaction tax; HFT; shares","","","","","","","","","","","","","","","","","","","","","","","","","","","","","","","","","","","","","","","","","","","","","","",""
"EPHS5YVR","journalArticle","2023","Lettieri, N; Guarino, A; Malandrino, D; Zaccagnino, R","Knowledge mining and social dangerousness assessment in criminal justice: metaheuristic integration of machine learning and graph-based inference","ARTIFICIAL INTELLIGENCE AND LAW","","0924-8463","10.1007/s10506-022-09334-7","","One of the main challenges for computational legal research is drawing up innovative heuristics to derive actionable knowledge from legal documents. While a large part of the research has been so far devoted to the extraction of purely legal information, less attention has been paid to seeking out in the texts the clues of more complex entities: legally relevant facts whose detection requires to link and interpret, as a unified whole, legal information and results of empirical analyses. This paper presents an ongoing research that points in this direction, trying to devise new ways to support public prosecutors in assessing the dangerousness of individuals and groups under investigation, an activity that precisely relies on the cross-sectional evaluation of legal and empirical data. A knowledge mining strategy will be outlined that lines up, into a single metaheuristic model, information extraction, network-based inference, machine learning and visual analytics. We will focus, in particular, on the integration of graph-based inference and machine learning methods used both to support classification tasks and to explore new forms of man-machine cooperation. Experiments made involving public prosecutors from the Italian Anti-Mafia Investigation Directorate and using data from real investigations have not only shown the potentialities of our approach but also offered an opportunity to reflect on the role we could assign to AI when thinking about the future of legal science and practice.","2023-12","2024-10-27 16:13:27","2024-10-27 16:13:27","","653-702","","4","31","","","","","","","","","","English","","","","WOS:000870659500001","","","","","","","NETWORK ANALYSIS; LAW; CLASSIFICATION; ARGUMENTATION; CRIME; EXTRACTION; AUGMENTED INTELLIGENCE COLLABORATION","","","","","","","","","","","","","","","","","","","","","","","","","","","","","","","","","","","","","","","","","","","","","","",""
"48B3K8CI","journalArticle","2023","Nolan, P; Matulionyte, R","Artificial Intelligence in Medicine: Issues When Determining Negligence","JOURNAL OF LAW AND MEDICINE","","1320-159X","","","The introduction of novel medical technology, such as artificial intelligence (AI), into traditional clinical practice presents legal liability challenges that need to be squarely addressed by litigants and courts when something goes wrong. Some of the most promising applications for the use of AI in medicine will lead to vexed liability questions. As AI in health care is in its relative infancy, there is a paucity of case law globally upon which to draw. This article analyses medical malpractice where AI is involved, what problems arise when applying the tort of negligence - such as establishing the essential elements of breach of duty of care and causation - and how can these can be addressed. Product liability under Australian Consumer Law is beyond the scope of this article. In order to address this question, the article: (1) identifies the general problems that black box AI causes in the health care sector; (2) identifies the problems that will arise in establishing breach and causation due to the ""black box"" nature of AI, with reference to the Civil Liability Act 2002 (NSW) and common law through two hypothetical examples; and (3) considers selected legal solutions to the problems caused by ""black box"" AI.","2023","2024-10-27 16:13:27","2024-10-27 16:13:27","","","","3","30","","","","","","","","","","English","","","","WOS:001162587800004","","","","","","","machine learning; AI; artificial intelligence; RISK; black box effect; CANCER; INFORMED-CONSENT; legal liability; medical care; negligence; PERFORMANCE; reasonable foreseeability; res ipsa loquitur","","","","","","","","","","","","","","","","","","","","","","","","","","","","","","","","","","","","","","","","","","","","","","",""
"ZCK8UFFU","journalArticle","2022","Jones, CC","SYSTEMATIZING DISCRIMINATION: AI VENDORS & TITLE VII ENFORCEMENT","UNIVERSITY OF PENNSYLVANIA LAW REVIEW","","0041-9907","","","For much of the last decade, scholars have highlighted both the role of AI and machine learning in reproducing inequality and the practical litigation di ffi culties such technologies create for proving intent. What the scholarship largely overlooks is the role of a handful of vendors who convert idiosyncratic biases into systematic, industry-wide barriers to employment opportunity. This capacity to scale discrimination in a way that may exclude certain groups from large segments of the labor market is a unique danger of AI vendors that warrants special scrutiny from Congress and regulators. Although underestimating the potential for harm, many scholars have also underestimated the e ff ectiveness of current law in addressing these problems. Thus, the EEOC and Congress should focus enforcement energy on AI vendors-through commissioner charges in the short term and through new legislation and regulation designed to meet the evolving challenges of AI hiring tools in the long term.","2022-12","2024-10-27 16:13:27","2024-10-27 16:13:27","","235-266","","1","171","","","","","","","","","","English","","","","WOS:001219086500005","","","","","","","","","","","","","","","","","","","","","","","","","","","","","","","","","","","","","","","","","","","","","","","","","","","","","",""
"7Q7HZ49Q","journalArticle","2023","Greif, E; Grosz, T","To see, or not to see: Online job advertisement and EU non-discrimination law","EUROPEAN LABOUR LAW JOURNAL","","2031-9525","10.1177/20319525231172089","","The recruitment process has largely moved online. Job advertisements which used to be bound to newspapers and other print media have become an online service as part of a growing trend towards a more digitalised hiring process. Alongside increased flexibility and cost-cutting, this trend brings so previously unseen challenges. The technology behind online job portals and social media allows job ads to be shown to targeted groups of people using machine learning techniques to filter through the available data and search for the most suitable audience. The correlations that are inferred by algorithms between content and audience, however, can lead to biased outcomes. This is a serious problem since the specific risk with online job ads is that jobseekers who are considered less suitable by the algorithm will not see the ad at all. Such a result effectively hinders access to the labour market and poses the risk of perpetuating existing biases and discrimination. Those discrimination risks raise questions about the legal framework of online job advertisements. This article examines the requirements of the new EU initiatives to regulate artificial intelligence and the digital market and EU non-discrimination law regarding online job advertisements. It also proposes a low-tech solution to the high-tech problems associated with online job advertisements by introducing a legal requirement to publicly tender job ads on an online noticeboard, thus ensuring transparency and effective access to employment.","2023-09","2024-10-27 16:13:27","2024-10-27 16:13:27","","376-390","","3","14","","","","","","","","","","English","","","","WOS:001046536000003","","","","","","","AI Act; EU labour law; non-discrimination; Digital Markets Act; Digital Services Act; online job advertisements","","","","","","","","","","","","","","","","","","","","","","","","","","","","","","","","","","","","","","","","","","","","","","",""
"SQLLX5BB","journalArticle","2023","Farmaki, D","The player, the programmer and the AI: a copyright odyssey in gaming","JOURNAL OF INTELLECTUAL PROPERTY LAW & PRACTICE","","1747-1532","10.1093/jiplp/jpad095","","The advancement of machine learning and artificial intelligence (AI) technology has fundamentally altered the production and ownership of works, including video games. That is because, with the development of AI systems, machines are now capable of not only producing works that are similar to existing ones but also creating works that are truly original and creative.The question of how such works should be protected under copyright law is a complex and evolving one. It is crucial to take into account the numerous approaches that have been proposed in this regard for the copyright protection of AI-generated works alongside related criticisms. Regardless of the approach employed, the issue of copyright protection for AI-generated works becomes more complicated if one considers the exclusive rights copyright holders enjoy, such as the communication to the public right via video game streaming.It will be feasible to create a framework for the protection of AI-generated works that is fair, effective and responsive to the requirements of both creators and users by carefully examining the legal and practical challenges involved.","2023-12-23","2024-10-27 16:13:27","2024-10-27 16:13:27","","920-928","","12","18","","","","","","","","","","English","","","","WOS:001107620900001","","","","","","","ARTIFICIAL-INTELLIGENCE","","","","","","","","","","","","","","","","","","","","","","","","","","","","","","","","","","","","","","","","","","","","","","",""
"KJF2A9DT","journalArticle","2023","Juliussen, BA; Rui, JP; Johansen, D","Algorithms that forget: Machine unlearning and the right to erasure","COMPUTER LAW & SECURITY REVIEW","","0267-3649","10.1016/j.clsr.2023.105885","","Article 17 of the General Data Protection Regulation (GDPR) contains a right for the data subject to obtain the erasure of personal data. The right to erasure in the GDPR gives, however, little clear guidance on how controllers processing personal data should erase the personal data to meet the requirements set out in Article 17. Machine Learning (ML) models that have been trained on personal data are downstream derivatives of the personal data used in the training data set of the ML process. A characteristic of ML is the non-deterministic nature of the learning process. The non-deterministic nature of ML poses significant difficulties in determining whether the personal data in the training data set affects the internal weights and adjusted parameters of the ML model. As a result, invoking the right to erasure in ML and to erase personal data from a ML model is a challenging task.This paper explores the complexities of enforcing and complying with the right to erasure in a ML context. It examines how novel developments in machine unlearning methods relate to Article 17 of the GDPR. Specifically, the paper delves into the intricacies of how personal data is processed in ML models and how the right to erasure could be implemented in such models. The paper also provides insights into how newly developed machine unlearning techniques could be applied to make ML models more GDPR compliant. The research aims to provide a functional understanding and contribute to a better comprehension of the applied challenges associated with the right to erasure in ML.(c) 2023 Bjorn Aslak Juliussen, Jon Petter Rui, Dag Johansen. Published by Elsevier Ltd. ( http://creativecommons.org/licenses/by/4.0/ )","2023-11","2024-10-27 16:13:27","2024-10-27 16:13:27","","","","","51","","","","","","","","","","English","","","","WOS:001081259400001","","","","","","","Machine learning; Data protection law; General data protection regulation; Machine unlearning; Privacy; The right to be forgotten; The right to erasure","","","","","","","","","","","","","","","","","","","","","","","","","","","","","","","","","","","","","","","","","","","","","","",""
"F58H6ED4","journalArticle","2023","Pacholska, M","Military Artificial Intelligence and the Principle of Distinction: A State Responsibility Perspective","ISRAEL LAW REVIEW","","0021-2237","10.1017/S0021223722000188","","Military artificial intelligence (AI)-enabled technology might still be in the relatively fledgling stages but the debate on how to regulate its use is already in full swing. Much of the discussion revolves around autonomous weapons systems (AWS) and the 'responsibility gap' they would ostensibly produce. This contribution argues that while some military AI technologies may indeed cause a range of conceptual hurdles in the realm of individual responsibility, they do not raise any unique issues under the law of state responsibility. The following analysis considers the latter regime and maps out crucial junctions in applying it to potential violations of the cornerstone of international humanitarian law (IHL) - the principle of distinction - resulting from the use of AI-enabled military technologies. It reveals that any challenges in ascribing responsibility in cases involving AWS would not be caused by the incorporation of AI, but stem from pre-existing systemic shortcomings of IHL and the unclear reverberations of mistakes thereunder. The article reiterates that state responsibility for the effects of AWS deployment is always retained through the commander's ultimate responsibility to authorise weapon deployment in accordance with IHL. It is proposed, however, that should the so-called fully autonomous weapon systems - that is, machine learning-based lethal systems that are capable of changing their own rules of operation beyond a predetermined framework - ever be fielded, it might be fairer to attribute their conduct to the fielding state, by conceptualising them as state agents, and treat them akin to state organs.","2023-03","2024-10-27 16:13:27","2024-10-27 16:13:27","","3-23","","1","56","","","","","","","","","","English","","","","WOS:001140502300001","","","","","","","artificial intelligence; autonomous weapons systems; mistake of fact; principle of distinction; state responsibility; WAR; WEAPONS","","","","","","","","","","","","","","","","","","","","","","","","","","","","","","","","","","","","","","","","","","","","","","",""
