"2NLXX7IU","conferencePaper","2023","Darji, H; Mitrovic, J; Granitzer, M; ACM","A Dataset of German Legal Reference Annotations","University of Passau","979-8-4007-0197-9","","10.1145/3594536.3595173","","The field of legal Natural Language Processing faces a lot of challenges due to the unavailability of properly structured datasets. One such instance is the need for a dataset that not only separates different parts of legal references, such as an article or paragraph number but also provides information about what a particular legal reference dictates. Having access to such a dataset can provide easy access to researchers working on experiments such as context similarity between law texts and legal cases that refer to a particular law. In this paper, we present a dataset of 2944 legal references in German law that are manually annotated by law experts. This dataset has 21 properties for each law reference in the dataset, such as Buch, Teil, Titel, Untertitel, etc. It also provides the complete text of each law reference in the dataset, along with specific paragraph text mentioned in the law reference. Furthermore, using this dataset together with Open Legal Data, we perform a law reference prediction task to compare the performance between predicting full law reference and only the base law reference.","2023","2024-10-27 16:11:54","2024-10-27 16:11:54","","392-396","","","","","","","","","","","","","English","","","","WOS:001139079400042","","","","","","","NLP; Law Reference Annotations; Law References; Legal Language Processing; Open Legal Data; Sentence Transformers","","","","","","","","","","","","","","","","","","","","","","","","","","","","","","","","PROCEEDINGS OF THE 19TH INTERNATIONAL CONFERENCE ON ARTIFICIAL INTELLIGENCE AND LAW, ICAIL 2023","","","","","","","","","","","","","","",""
"X77MWP7F","journalArticle","2024","Licari, D; Comandè, G","ITALIAN-LEGAL-BERT models for improving natural language processing tasks in the Italian legal domain","COMPUTER LAW & SECURITY REVIEW","","0267-3649","10.1016/j.clsr.2023.105908","","Legal-BERT models are based on the BERT architecture (or its variants) and have been developed specifically for the legal domain. They have reached the state of the art in complex legal tasks such as legal research, document synthesis, contract analysis, argument extraction, and legal prediction. In this paper, we proposed four versions of Legal-BERT models pre-trained on the Italian legal domain. They aim to improve NLP applications in the Italian legal context. We have shown that they outperforms the Italian ""generalpurpose"" BERT in several domain-specific tasks, such as named entity recognition, sentence classification, semantic similarity with Bi-encoders, and document classification.","2024-04","2024-10-27 16:12:05","2024-10-27 16:12:05","","","","","52","","","","","","","","","","English","","","","WOS:001102220200001","","","","","","","Italian Legal BERT; Italian Legal NLP; Legal AI; Pre-trained Language Models","","","","","","","","","","","","","","","","","","","","","","","","","","","","","","","","","","","","","","","","","","","","","","",""
"UX3RJ3QH","conferencePaper","2023","Blair-Stanek, A; Holzenberger, N; Van Durme, B; ACM","Can GPT-3 Perform Statutory Reasoning?","University System of Maryland","979-8-4007-0197-9","","10.1145/3594536.3595163","","Statutory reasoning is the task of reasoning with facts and statutes, which are rules written in natural language by a legislature. It is a basic legal skill. In this paper we explore the capabilities of the most capable GPT-3 model, text-davinci-003, on an established statutory-reasoning dataset called SARA. We consider a variety of approaches, including dynamic few-shot prompting, chain-of-thought prompting, and zero-shot prompting. While we achieve results with GPT-3 that are better than the previous best published results, we also identify several types of clear errors it makes. We investigate why these errors happen. We discover that GPT-3 has imperfect prior knowledge of the actual U.S. statutes on which SARA is based. More importantly, we create simple synthetic statutes, which GPT-3 is guaranteed not to have seen during training. We find GPT-3 performs poorly at answering straightforward questions about these simple synthetic statutes.","2023","2024-10-27 16:12:06","2024-10-27 16:12:06","","22-31","","","","","","","","","","","","","English","","","","WOS:001139079400003","","","","","","","natural language processing; GPT-3; law; reasoning; statutes","","","","","","","","","","","","","","","","","","","","","","","","","","","","","","","","PROCEEDINGS OF THE 19TH INTERNATIONAL CONFERENCE ON ARTIFICIAL INTELLIGENCE AND LAW, ICAIL 2023","","","","","","","","","","","","","","",""
"RYUCA2M5","journalArticle","2024","Martínez, E","Re-evaluating GPT-4's bar exam performance","ARTIFICIAL INTELLIGENCE AND LAW","","0924-8463","10.1007/s10506-024-09396-9","","Perhaps the most widely touted of GPT-4's at-launch, zero-shot capabilities has been its reported 90th-percentile performance on the Uniform Bar Exam. This paper begins by investigating the methodological challenges in documenting and verifying the 90th-percentile claim, presenting four sets of findings that indicate that OpenAI's estimates of GPT-4's UBE percentile are overinflated. First, although GPT-4's UBE score nears the 90th percentile when examining approximate conversions from February administrations of the Illinois Bar Exam, these estimates are heavily skewed towards repeat test-takers who failed the July administration and score significantly lower than the general test-taking population. Second, data from a recent July administration of the same exam suggests GPT-4's overall UBE percentile was below the 69th percentile, and similar to \documentclass[12pt]{minimal} \usepackage{amsmath} \usepackage{wasysym} \usepackage{amsfonts} \usepackage{amssymb} \usepackage{amsbsy} \usepackage{mathrsfs} \usepackage{upgreek} \setlength{\oddsidemargin}{-69pt} \begin{document}$$\sim$$\end{document} 48th percentile on essays. Third, examining official NCBE data and using several conservative statistical assumptions, GPT-4's performance against first-time test takers is estimated to be similar to \documentclass[12pt]{minimal} \usepackage{amsmath} \usepackage{wasysym} \usepackage{amsfonts} \usepackage{amssymb} \usepackage{amsbsy} \usepackage{mathrsfs} \usepackage{upgreek} \setlength{\oddsidemargin}{-69pt} \begin{document}$$\sim$$\end{document} 62nd percentile, including similar to \documentclass[12pt]{minimal} \usepackage{amsmath} \usepackage{wasysym} \usepackage{amsfonts} \usepackage{amssymb} \usepackage{amsbsy} \usepackage{mathrsfs} \usepackage{upgreek} \setlength{\oddsidemargin}{-69pt} \begin{document}$$\sim$$\end{document} 42nd percentile on essays. Fourth, when examining only those who passed the exam (i.e. licensed or license-pending attorneys), GPT-4's performance is estimated to drop to similar to \documentclass[12pt]{minimal} \usepackage{amsmath} \usepackage{wasysym} \usepackage{amsfonts} \usepackage{amssymb} \usepackage{amsbsy} \usepackage{mathrsfs} \usepackage{upgreek} \setlength{\oddsidemargin}{-69pt} \begin{document}$$\sim$$\end{document} 48th percentile overall, and similar to \documentclass[12pt]{minimal} \usepackage{amsmath} \usepackage{wasysym} \usepackage{amsfonts} \usepackage{amssymb} \usepackage{amsbsy} \usepackage{mathrsfs} \usepackage{upgreek} \setlength{\oddsidemargin}{-69pt} \begin{document}$$\sim$$\end{document} 15th percentile on essays. In addition to investigating the validity of the percentile claim, the paper also investigates the validity of GPT-4's reported scaled UBE score of 298. The paper successfully replicates the MBE score, but highlights several methodological issues in the grading of the MPT + MEE components of the exam, which call into question the validity of the reported essay score. Finally, the paper investigates the effect of different hyperparameter combinations on GPT-4's MBE performance, finding no significant effect of adjusting temperature settings, and a significant effect of few-shot chain-of-thought prompting over basic zero-shot prompting. Taken together, these findings carry timely insights for the desirability and feasibility of outsourcing legally relevant tasks to AI models, as well as for the importance for AI developers to implement rigorous and transparent capabilities evaluations to help secure safe and trustworthy AI.","2024-03-30","2024-10-27 16:12:06","2024-10-27 16:12:06","","","","","","","","","","","","","","","English","","","","WOS:001194581100001","","","","","","","NLP; Machine learning; Natural language processing; LAW; Artificial intelligence; Artificial intelligence and law; Law and technology; Legal analytics; Legal NLP; Legal profession","","","","","","","","","","","","","","","","","","","","","","","","","","","","","","","","","","","","","","","","","","","","","","",""
"GAJS9W3K","conferencePaper","2023","Nguyen, HT; Goebel, R; Toni, F; Stathis, K; Satoh, K","LawGiBa - Combining GPT, Knowledge Bases, and Logic Programming in a Legal Assistance System","Research Organization of Information & Systems (ROIS)","0922-6389","","10.3233/FAIA230991","","We present LawGiBa, a proof-of-concept demonstration system for legal assistance that combines GPT, legal knowledge bases, and Prolog's logic programming structure to provide explanations for legal queries. This novel combination effectively and feasibly addresses the hallucination issue of large language models (LLMs) in critical domains, such as law. Through this system, we demonstrate how incorporating a legal knowledge base and logical reasoning can enhance the accuracy and reliability of legal advice provided by AI models like GPT. Though our work is primarily a demonstration, it provides a framework to explore how knowledge bases and logic programming structures can be further integrated with generative AI systems, to achieve improved results across various natural languages and legal systems.","2023","2024-10-27 16:12:06","2024-10-27 16:12:06","","371-374","","","379","","","","","","","","","","English","","","","WOS:001175464100050","","","","","","","ChatGPT; interactive demonstration; knowledge base; legal advice; logic programming; Prolog","","Spanakis, J; VanDijck, G; Sileno, G","","","","","","","","","","","","","","","","","","","","","","","","","","","","","","LEGAL KNOWLEDGE AND INFORMATION SYSTEMS","","","","","","","","","","","","","","",""
"SSQX7SJQ","conferencePaper","2023","Hillebrand, L; Pielka, M; Leonhard, D; Deusser, T; Dilmaghani, T; Kliem, B; Loitz, R; Morad, M; Temath, C; Bell, T; Stenzel, R; Sifa, R; ACM","sustain.AI: a Recommender System to analyze Sustainability Reports","","979-8-4007-0197-9","","10.1145/3594536.3595131","","We present sustain.AI, an intelligent, context-aware recommender system that assists auditors and financial investors as well as the general public to efficiently analyze companies' sustainability reports. The tool leverages an end-to-end trainable architecture that couples a BERT-based encoding module with a multi-label classification head to match relevant text passages from sustainability reports to their respective law regulations from the Global Reporting Initiative (GRI) standards. We evaluate our model on two novel German sustainability reporting data sets and consistently achieve a significantly higher recommendation performance compared to multiple strong baselines. Furthermore, sustain.AI is publicly available for everyone at https://sustain.ki.nrw/.","2023","2024-10-27 16:12:06","2024-10-27 16:12:06","","412-416","","","","","","","","","","","","","English","","","","WOS:001139079400046","","","","","","","natural language processing; recommender system; sustainability","","","","","","","","","","","","","","","","","","","","","","","","","","","","","","","","PROCEEDINGS OF THE 19TH INTERNATIONAL CONFERENCE ON ARTIFICIAL INTELLIGENCE AND LAW, ICAIL 2023","","","","","","","","","","","","","","",""
"4PXGXJ3R","conferencePaper","2023","Al Mouatamid, Y; Zahir, J; Bonnin, M; Mousannif, H","Assessing Ocean's Legal Protection Using AI: A New Dataset and a BERT-Based Classifier","Cadi Ayyad University of Marrakech","0922-6389","","10.3233/FAIA230972","","This paper aims to address the challenge of using artificial intelligence for empirical legal studies. We introduce a new annotated dataset on French marine environmental law dealing with definitions, bans, sanctions, and controls on living (turtles and seabirds) and non-living (plastic bags and straws) subjects. The annotation has been produced by law students and validated by a legal expert. Based on the developed dataset, we train a CamemBERT-based classifier which accurately predicts the class of a given legal article according to the pre-defined classes within the dataset we have created. The proposed training set and the resulting trained model provide a better interpretation and accessibility of legal texts to specialists and the general public, based on findings from legal studies and on natural language processing techniques.","2023","2024-10-27 16:12:06","2024-10-27 16:12:06","","263-268","","","379","","","","","","","","","","English","","","","WOS:001175464100032","","","","","","","Machine learning; CamemBERT; Classification; datasets; empirical legal studies; marine environmental law","","Spanakis, J; VanDijck, G; Sileno, G","","","","","","","","","","","","","","","","","","","","","","","","","","","","","","LEGAL KNOWLEDGE AND INFORMATION SYSTEMS","","","","","","","","","","","","","","",""
"NEDK7WRJ","conferencePaper","2023","Mumford, J; Atkinson, K; Bench-Capon, T; ACM","Combining a Legal Knowledge Model with Machine Learning for Reasoning with Legal Cases","University of Liverpool","979-8-4007-0197-9","","10.1145/3594536.3595158","","Recent years have witnessed significant progress in the deployment of advanced Natural Language Processing (NLP) techniques based on transformer technology, across many domains and applications. However, in legal domains, due to the complexity, length, and sparsity of legal case documents, the use of these advanced NLP techniques has offered comparatively slight returns. Perhaps even more importantly, such methods are critically lacking in explainability and justification of outputs, which are essential for many legal applications. We propose that the direction of these NLP techniques should be aimed at ascription to a legal knowledge model, which can then provide the necessary and auditable justifications for the rationale of any case outcome. In this paper we investigate the effectiveness of using Hierarchical Bidirectional Encoder Representations from Transformers (H-BERT) models to ascribe to an Angelic Domain Model (ADM) that is able to represent the legal knowledge of a domain in a structured way, enabling justifications and improving performance. Our study involved an annotation task on a popular domain, cases from the European Court of Human Rights, to gain an understanding of the balance of complaints in the domain. The data set produced from this study enabled training of models for factor ascription using the classification targets derived from the annotations. We present results of experiments conducted to evaluate the performance of the ascription task at three different levels of abstraction within the structured model.","2023","2024-10-27 16:12:06","2024-10-27 16:12:06","","167-176","","","","","","","","","","","","","English","","","","WOS:001139079400018","","","","","","","case annotation; domain model; factor ascription; Transformers","","","","","","","","","","","","","","","","","","","","","","","","","","","","","","","","PROCEEDINGS OF THE 19TH INTERNATIONAL CONFERENCE ON ARTIFICIAL INTELLIGENCE AND LAW, ICAIL 2023","","","","","","","","","","","","","","",""
"MUUSD3NR","journalArticle","2023","Yao, L","Specifics of Regulatory and Legal Regulation of Generative Artificial Intelligence in the UK, USA, EU and China","PRAVO-ZHURNAL VYSSHEI SHKOLY EKONOMIKI","","2072-8166","10.17323/2072-8166.2023.3.245.267","","On November 30, 2022, OpenAI launched ChatGPT conversational artificial intelligence; with the latest version update, ChatGPT has demonstrated an impressive ability to understand natural language, making it an attractive tool for companies and individuals looking to provide customer service and support. GPT-3 uses textual data, mostly from publicly available information on the Internet, as training data. GPT-4, on the other hand, uses a large number of images in addition to textual data for training, and thus can process both textual and graphical data. The emergence of generative AI has greatly impacted human life, but it can be said that intelligent technology is a double-edged sword:rapid development of generative artificial intelligence (AI) technologies, on the one hand, it can improve efficiency and productivity, reduce costs and open new opportunities for economic growth, but on the other hand, the use of generative AI services to create synthetic content in the form of text, audio, video and images poses possible risks. To date, different regions around the world are at different stages of development of normative acts concerning generative AI.Using the comparative legal method and the method of system analysis, this article analyzes in detail the main models of legal regulation of generative AI in the modern world on the example of the UK, the USA, the European Union and China, noting the different approach in the development and adoption of relevant normative legal acts in the field of regulation of generative AI services.It especially reveals the Chinese government's position on ""development and security"" and ""innovation and governance"" at present. The main trends of improving the regulation of generative AI services by China are proposed, and it is concluded that it is necessary to balance ""rule of law"" and ""innovation"" and promote the healthy development of generative AI.","2023","2024-10-27 16:12:06","2024-10-27 16:12:06","","245-267","","3","","","","","","","","","","","Russian","","","","WOS:001083415400011","","","","","","","regulation; Generative AI; Chat Generative Pre-TrainedTransformer, risks; foreign experience; innovations","","","","","","","","","","","","","","","","","","","","","","","","","","","","","","","","","","","","","","","","","","","","","","",""
"GHUJQ4D5","journalArticle","2024","Rehaag, S","Luck of the Draw III: Using AI to Extract Data About Decision-Making in Federal Court Stays of Removal","QUEENS LAW JOURNAL","","0316-778X","","","This article examines decision-making in Federal Court of Canada immigration law applications for stays of removal, focusing on how the rates at which stays are granted depend on which justice decides the case. The article deploys a form of computational natural language processing, using a large-language model machine learning process (GPT-3) to extract data from online Federal Court dockets. The article reviews patterns in outcomes in thousands of stay of removal applications identified through this process and reveals a wide range in stay grant rates across many justices. The article argues that the Federal Court should take measures to encourage more consistency in stay decision-making and cautions against relying heavily on stays of removal to ensure that deportation complies with constitutional procedural justice protections. The article is also a demonstration of how machine learning can be used to pursue empirical legal research projects that would have been cost prohibitive or technically challenging only a few years ago-and shows how technology that is increasingly used to enhance the power of the state at the expense of marginalized migrants can instead be used to scrutinize legal decision-making in the immigration law field, hopefully in ways that enhance the rights of migrants. The article also contributes to the broader field of computational legal research in Canada by making available to other non-commercial researchers the code used for the project, as well as a dataset of several thousand Federal Court dockets that can be used for future research.","2024","2024-10-27 16:12:06","2024-10-27 16:12:06","","73-126","","2","49","","","","","","","","","","English","","","","WOS:001245221700003","","","","","","","REFUGEE DETERMINATIONS","","","","","","","","","","","","","","","","","","","","","","","","","","","","","","","","","","","","","","","","","","","","","","",""
"KN2UDCVP","journalArticle","2024","Licari, D; Comandè, G","ITALIAN-LEGAL-BERT models for improving natural language processing tasks in the Italian legal domain","COMPUTER LAW & SECURITY REVIEW","","0267-3649","10.1016/j.clsr.2023.105908","","Legal-BERT models are based on the BERT architecture (or its variants) and have been developed specifically for the legal domain. They have reached the state of the art in complex legal tasks such as legal research, document synthesis, contract analysis, argument extraction, and legal prediction. In this paper, we proposed four versions of Legal-BERT models pre-trained on the Italian legal domain. They aim to improve NLP applications in the Italian legal context. We have shown that they outperforms the Italian ""generalpurpose"" BERT in several domain-specific tasks, such as named entity recognition, sentence classification, semantic similarity with Bi-encoders, and document classification.","2024-04","2024-10-27 16:12:43","2024-10-27 16:12:43","","","","","52","","","","","","","","","","English","","","","WOS:001102220200001","","","","","","","Italian Legal BERT; Italian Legal NLP; Legal AI; Pre-trained Language Models","","","","","","","","","","","","","","","","","","","","","","","","","","","","","","","","","","","","","","","","","","","","","","",""
"KUCFES87","conferencePaper","2023","Khatri, M; Sheik, R; Wadhwa, P; Satija, G; Kumar, Y; Shah, RR; Kumaraguru, P","CiteCaseLAW: Citation Worthiness Detection in Caselaw for Legal Assistive Writing","Indraprastha Institute of Information Technology Delhi","0922-6389","","10.3233/FAIA230971","","Complex legal language, filled with jargon, nuanced language semantics, and a high level of domain specificity, poses a significant challenge for automation in handling various legal tasks. In the realm of legal document composition, a pivotal component revolves around accurately referencing case laws and other sources to substantiate assertions and arguments. Understanding the legal domain and identifying appropriate citation context or cite-worthy sentences automatically is challenging. Our research is centered on the issue of citation-worthiness identification of a given sentence. This serves as the initial phase in contemporary citation recommendation systems, aimed at alleviating the effort involved in extracting a suitable array of citation contexts. To address this, we first introduce a labeled dataset comprising 178 million sentences, specifically tailored for detecting citation-worthy content within the legal domain. This dataset is curated from the Caselaw Access Project (CAP)(2) (https://case.law/). We proceeded to assess the performance of a range of deep learning models on this novel dataset. Among the models examined, the domain-specific pre-trained model consistently demonstrated superior performance, achieving an 88% F1-score in the task of detecting citation-worthy material. To enhance our insights, we employed inputXGradient explainable AI techniques to dissect the predictions, thereby identifying the tokens that contribute to specific citation classes.","2023","2024-10-27 16:12:43","2024-10-27 16:12:43","","257-262","","","379","","","","","","","","","","English","","","","WOS:001175464100031","","","","","","","Classification; Legal NLP; Citation","","Spanakis, J; VanDijck, G; Sileno, G","","","","","","","","","","","","","","","","","","","","","","","","","","","","","","LEGAL KNOWLEDGE AND INFORMATION SYSTEMS","","","","","","","","","","","","","","",""
