"2X6GMPUN","journalArticle","2024","Martínez, E","Re-evaluating GPT-4's bar exam performance","ARTIFICIAL INTELLIGENCE AND LAW","","0924-8463","10.1007/s10506-024-09396-9","","Perhaps the most widely touted of GPT-4's at-launch, zero-shot capabilities has been its reported 90th-percentile performance on the Uniform Bar Exam. This paper begins by investigating the methodological challenges in documenting and verifying the 90th-percentile claim, presenting four sets of findings that indicate that OpenAI's estimates of GPT-4's UBE percentile are overinflated. First, although GPT-4's UBE score nears the 90th percentile when examining approximate conversions from February administrations of the Illinois Bar Exam, these estimates are heavily skewed towards repeat test-takers who failed the July administration and score significantly lower than the general test-taking population. Second, data from a recent July administration of the same exam suggests GPT-4's overall UBE percentile was below the 69th percentile, and similar to \documentclass[12pt]{minimal} \usepackage{amsmath} \usepackage{wasysym} \usepackage{amsfonts} \usepackage{amssymb} \usepackage{amsbsy} \usepackage{mathrsfs} \usepackage{upgreek} \setlength{\oddsidemargin}{-69pt} \begin{document}$$\sim$$\end{document} 48th percentile on essays. Third, examining official NCBE data and using several conservative statistical assumptions, GPT-4's performance against first-time test takers is estimated to be similar to \documentclass[12pt]{minimal} \usepackage{amsmath} \usepackage{wasysym} \usepackage{amsfonts} \usepackage{amssymb} \usepackage{amsbsy} \usepackage{mathrsfs} \usepackage{upgreek} \setlength{\oddsidemargin}{-69pt} \begin{document}$$\sim$$\end{document} 62nd percentile, including similar to \documentclass[12pt]{minimal} \usepackage{amsmath} \usepackage{wasysym} \usepackage{amsfonts} \usepackage{amssymb} \usepackage{amsbsy} \usepackage{mathrsfs} \usepackage{upgreek} \setlength{\oddsidemargin}{-69pt} \begin{document}$$\sim$$\end{document} 42nd percentile on essays. Fourth, when examining only those who passed the exam (i.e. licensed or license-pending attorneys), GPT-4's performance is estimated to drop to similar to \documentclass[12pt]{minimal} \usepackage{amsmath} \usepackage{wasysym} \usepackage{amsfonts} \usepackage{amssymb} \usepackage{amsbsy} \usepackage{mathrsfs} \usepackage{upgreek} \setlength{\oddsidemargin}{-69pt} \begin{document}$$\sim$$\end{document} 48th percentile overall, and similar to \documentclass[12pt]{minimal} \usepackage{amsmath} \usepackage{wasysym} \usepackage{amsfonts} \usepackage{amssymb} \usepackage{amsbsy} \usepackage{mathrsfs} \usepackage{upgreek} \setlength{\oddsidemargin}{-69pt} \begin{document}$$\sim$$\end{document} 15th percentile on essays. In addition to investigating the validity of the percentile claim, the paper also investigates the validity of GPT-4's reported scaled UBE score of 298. The paper successfully replicates the MBE score, but highlights several methodological issues in the grading of the MPT + MEE components of the exam, which call into question the validity of the reported essay score. Finally, the paper investigates the effect of different hyperparameter combinations on GPT-4's MBE performance, finding no significant effect of adjusting temperature settings, and a significant effect of few-shot chain-of-thought prompting over basic zero-shot prompting. Taken together, these findings carry timely insights for the desirability and feasibility of outsourcing legally relevant tasks to AI models, as well as for the importance for AI developers to implement rigorous and transparent capabilities evaluations to help secure safe and trustworthy AI.","2024-03-30","2024-10-27 16:12:44","2024-10-27 16:12:44","","","","","","","","","","","","","","","English","","","","WOS:001194581100001","","","","","","","NLP; Machine learning; Natural language processing; LAW; Artificial intelligence; Artificial intelligence and law; Law and technology; Legal analytics; Legal NLP; Legal profession","","","","","","","","","","","","","","","","","","","","","","","","","","","","","","","","","","","","","","","","","","","","","","",""
"ZZJC3EME","journalArticle","2024","Egger, C; Caselli, T; Tziafas, G; Phalle, ED; Vries, WD","Extracting and classifying exceptional COVID-19 measures from multilingual legal texts: The merits and limitations of automated approaches","REGULATION & GOVERNANCE","","1748-5983","10.1111/rego.12557","","This paper contributes to ongoing scholarly debates on the merits and limitations of computational legal text analysis by reflecting on the results of a research project documenting exceptional COVID-19 management measures in Europe. The variety of exceptional measures adopted in countries characterized by different legal systems and natural languages, as well as the rapid evolution of such measures, pose considerable challenges to manual textual analysis methods traditionally used in the social sciences. To address these challenges, we develop a supervised classifier to support the manual coding of exceptional policies by a multinational team of human coders. After presenting the results of various natural language processing (NLP) experiments, we show that human-in-the-loop approaches to computational text analysis outperform unsupervised approaches in accurately extracting policy events from legal texts. We draw lessons from our experience to ensure the successful integration of NLP methods into social science research agendas.","2024-07","2024-10-27 16:12:58","2024-10-27 16:12:58","","704-723","","3","18","","","","","","","","","","English","","","","WOS:001079523000001","","","","","","","computational text analysis; COVID-19; crisis governance; EMERGENCY; law-as-data; natural language processing; SCIENCE","","","","","","","","","","","","","","","","","","","","","","","","","","","","","","","","","","","","","","","","","","","","","","",""
"GQCBDM3M","journalArticle","2024","Kretschmer, M; Margoni, T; Oruç, P","Copyright Law and the Lifecycle of Machine Learning Models","IIC-INTERNATIONAL REVIEW OF INTELLECTUAL PROPERTY AND COMPETITION LAW","","0018-9855","10.1007/s40319-023-01419-3","","Machine learning, a subfield of artificial intelligence (AI), relies on large corpora of data as input for learning algorithms, resulting in trained models that can perform a variety of tasks. While data or information are not subject matter within copyright law, almost all materials used to construct corpora for machine learning are protected by copyright law: texts, images, videos, and so on. There are global policy moves to address the copyright implications of machine learning, in particular in the context of so-called ""foundation models"" that underpin generative AI. This paper takes a step back, exploring empirically three technological settings through detailed case studies. We set out the established industry methodology of a lifecycle of AI (collecting data, organising data, model training, model operation) to arrive at descriptions suitable for legal analysis. This will allow an assessment of the challenges for a harmonisation of rights, exceptions and disclosure under EU copyright law. The three case studies are:Machine learning for scientific purposes, in the context of a study of regional short-term letting markets;Natural Language Processing (NLP), in the context of large language models;Computer vision, in the context of content moderation of images.We find that the nature and quality of data corpora at the input stage is central to the lifecycle of machine learning. Because of the uncertain legal status of data collection and processing, combined with the competitive advantage gained by firms not disclosing technological advances, the inputs of the models deployed are often unknown. Moreover, the ""lawful access"" requirement of the EU exception for text and data mining may turn the exception into a decision by rightholders to allow machine learning in the context of their decision to allow access. We assess policy interventions at EU level, seeking to clarify the legal status of input data via copyright exceptions, opt-outs or the forced disclosure of copyright materials. We find that the likely result is a fully copyright-licensed environment of machine learning that may have problematic effects for the structure of industry, innovation and scientific research.","2024-01","2024-10-27 16:13:26","2024-10-27 16:13:26","","110-138","","1","55","","","","","","","","","","English","","","","WOS:001155789200001","","","","","","","Artificial intelligence; Copyright; Data mining; Digital single market; EU; TEXT; Text mining","","","","","","","","","","","","","","","","","","","","","","","","","","","","","","","","","","","","","","","","","","","","","","",""
"2W7R7UUV","journalArticle","2024","Izarova, I; Uhrynovska, O; Khotynska-Nor, O; Prytyka, Y; Bedyukh, O; Alendar, Y","ADVANCING SUSTAINABLE JUSTICE THROUGH AI-BASED CASE LAW ANALYSIS: UKRAINIAN EXPERIENCE","ACCESS TO JUSTICE IN EASTERN EUROPE","","2663-0575","10.33327/AJEE-18-7.1-a000123","","Background: Ukraine has a unique Unified State Register of Court Decisions that publishes all court decisions in cases considered and resolved by courts in the public domain. There are more than one hundred million such documents in the register today. This provides unique opportunities for collecting, analysing, and summarising the empirical base of justice. This has the potential to form the basis for further transformation of the national model of justice. This study's impetus may have risen from the realisation that relying solely on human resources for such endeavours may present challenges.Methods: The study is based on the hypothesis that using hardware and software to analyse large data sets of state registers of court decisions and judicial statistics data can identify persistent patterns and causes of inefficient functioning of the judicial system.Results and Conclusions: The study led to the development of software with functionality that annotates court decision text, intended for further use in advanced Natural Language Processing algorithms. Furthermore, the study underscores the need to develop an algorithm for predicting risks and outcomes of court proceedings and a methodology for processing large amounts of data from the Unified State Register of Court Decisions. This is justified based on specific indicators of the effectiveness of dispute resolution. This article advocates for the use of machine learning algorithms as an innovative tool to generalise large data sets from court decision registers, particularly to obtain objective data on a large scale. The article also examines the prerequisites for establishing the Institute of National Judicial Practice and explores its functioning in the present stage of judicial reform.","2024-02","2024-10-27 16:13:27","2024-10-27 16:13:27","","127-148","","1","","","","","","","","","","","English","","","","WOS:001128775200001","","","","","","","artificial intelligence; analysis of large data sets; civil procedure; court decisions; e-justice; judicial reform; judicial statistics; judicial system; legal proceedings","","","","","","","","","","","","","","","","","","","","","","","","","","","","","","","","","","","","","","","","","","","","","","",""
"CIQMQWIX","journalArticle","2024","Martínez, E","Re-evaluating GPT-4's bar exam performance","ARTIFICIAL INTELLIGENCE AND LAW","","0924-8463","10.1007/s10506-024-09396-9","","Perhaps the most widely touted of GPT-4's at-launch, zero-shot capabilities has been its reported 90th-percentile performance on the Uniform Bar Exam. This paper begins by investigating the methodological challenges in documenting and verifying the 90th-percentile claim, presenting four sets of findings that indicate that OpenAI's estimates of GPT-4's UBE percentile are overinflated. First, although GPT-4's UBE score nears the 90th percentile when examining approximate conversions from February administrations of the Illinois Bar Exam, these estimates are heavily skewed towards repeat test-takers who failed the July administration and score significantly lower than the general test-taking population. Second, data from a recent July administration of the same exam suggests GPT-4's overall UBE percentile was below the 69th percentile, and similar to \documentclass[12pt]{minimal} \usepackage{amsmath} \usepackage{wasysym} \usepackage{amsfonts} \usepackage{amssymb} \usepackage{amsbsy} \usepackage{mathrsfs} \usepackage{upgreek} \setlength{\oddsidemargin}{-69pt} \begin{document}$$\sim$$\end{document} 48th percentile on essays. Third, examining official NCBE data and using several conservative statistical assumptions, GPT-4's performance against first-time test takers is estimated to be similar to \documentclass[12pt]{minimal} \usepackage{amsmath} \usepackage{wasysym} \usepackage{amsfonts} \usepackage{amssymb} \usepackage{amsbsy} \usepackage{mathrsfs} \usepackage{upgreek} \setlength{\oddsidemargin}{-69pt} \begin{document}$$\sim$$\end{document} 62nd percentile, including similar to \documentclass[12pt]{minimal} \usepackage{amsmath} \usepackage{wasysym} \usepackage{amsfonts} \usepackage{amssymb} \usepackage{amsbsy} \usepackage{mathrsfs} \usepackage{upgreek} \setlength{\oddsidemargin}{-69pt} \begin{document}$$\sim$$\end{document} 42nd percentile on essays. Fourth, when examining only those who passed the exam (i.e. licensed or license-pending attorneys), GPT-4's performance is estimated to drop to similar to \documentclass[12pt]{minimal} \usepackage{amsmath} \usepackage{wasysym} \usepackage{amsfonts} \usepackage{amssymb} \usepackage{amsbsy} \usepackage{mathrsfs} \usepackage{upgreek} \setlength{\oddsidemargin}{-69pt} \begin{document}$$\sim$$\end{document} 48th percentile overall, and similar to \documentclass[12pt]{minimal} \usepackage{amsmath} \usepackage{wasysym} \usepackage{amsfonts} \usepackage{amssymb} \usepackage{amsbsy} \usepackage{mathrsfs} \usepackage{upgreek} \setlength{\oddsidemargin}{-69pt} \begin{document}$$\sim$$\end{document} 15th percentile on essays. In addition to investigating the validity of the percentile claim, the paper also investigates the validity of GPT-4's reported scaled UBE score of 298. The paper successfully replicates the MBE score, but highlights several methodological issues in the grading of the MPT + MEE components of the exam, which call into question the validity of the reported essay score. Finally, the paper investigates the effect of different hyperparameter combinations on GPT-4's MBE performance, finding no significant effect of adjusting temperature settings, and a significant effect of few-shot chain-of-thought prompting over basic zero-shot prompting. Taken together, these findings carry timely insights for the desirability and feasibility of outsourcing legally relevant tasks to AI models, as well as for the importance for AI developers to implement rigorous and transparent capabilities evaluations to help secure safe and trustworthy AI.","2024-03-30","2024-10-27 16:13:27","2024-10-27 16:13:27","","","","","","","","","","","","","","","English","","","","WOS:001194581100001","","","","","","","NLP; Machine learning; Natural language processing; LAW; Artificial intelligence; Artificial intelligence and law; Law and technology; Legal analytics; Legal NLP; Legal profession","","","","","","","","","","","","","","","","","","","","","","","","","","","","","","","","","","","","","","","","","","","","","","",""
"I48F535F","journalArticle","2024","Herbosch, M","Fraud by generative AI chatbots: On the thin line between deception and negligence","COMPUTER LAW & SECURITY REVIEW","","0267-3649","10.1016/j.clsr.2024.105941","","The use of generative AI systems is on the rise. As a result, we are increasingly often conversing with AI chatbots rather than with fellow humans. This increasing use of AI systems leads to legal challenges as well, particularly when the chatbot provides incorrect information. In this article, we study whether someone who decides to contract on the basis of incorrect information provided by a generative AI chatbot might invoke the fraud regime to annul the resulting contract in various legal systems. During this analysis, it becomes clear that some of the requirements that are currently being put forward from a public law perspective, such as in the European AI Act, may also naturally arise from existing private law figures. In the same vein, this analysis highlights the interesting intradisciplinary feedback between instruments of public law and other legal domains.","2024-04","2024-10-27 16:14:03","2024-10-27 16:14:03","","","","","52","","","","","","","","","","English","","","","WOS:001178316700001","","","","","","","Artificial intelligence; BLACK-BOX; Contract law; Fraud; Law of obligations; Vice of consent","","","","","","","","","","","","","","","","","","","","","","","","","","","","","","","","","","","","","","","","","","","","","","",""
"5Q6EYJ9Z","conferencePaper","2023","Nguyen, HT; Goebel, R; Toni, F; Stathis, K; Satoh, K","LawGiBa - Combining GPT, Knowledge Bases, and Logic Programming in a Legal Assistance System","Research Organization of Information & Systems (ROIS)","0922-6389","","10.3233/FAIA230991","","We present LawGiBa, a proof-of-concept demonstration system for legal assistance that combines GPT, legal knowledge bases, and Prolog's logic programming structure to provide explanations for legal queries. This novel combination effectively and feasibly addresses the hallucination issue of large language models (LLMs) in critical domains, such as law. Through this system, we demonstrate how incorporating a legal knowledge base and logical reasoning can enhance the accuracy and reliability of legal advice provided by AI models like GPT. Though our work is primarily a demonstration, it provides a framework to explore how knowledge bases and logic programming structures can be further integrated with generative AI systems, to achieve improved results across various natural languages and legal systems.","2023","2024-10-27 16:14:04","2024-10-27 16:14:04","","371-374","","","379","","","","","","","","","","English","","","","WOS:001175464100050","","","","","","","ChatGPT; interactive demonstration; knowledge base; legal advice; logic programming; Prolog","","Spanakis, J; VanDijck, G; Sileno, G","","","","","","","","","","","","","","","","","","","","","","","","","","","","","","LEGAL KNOWLEDGE AND INFORMATION SYSTEMS","","","","","","","","","","","","","","",""
"T9RDC7M5","journalArticle","2023","Chen, SS","THE DAWN OF AI GENERATED CONTENTS: REVISITING COMPULSORY MEDIATION AND IP DISPUTES RESOLUTION","CONTEMPORARY ASIA ARBITRATION JOURNAL","","1999-9747","","","With the popularity of generative artificial intelligence (hereinafter ""AI""), current intellectual property laws are being greatly challenged and the established doctrines redefined. As different jurisdictions are in the process of ""catching up"" to the technology, this paper argues that compulsory mediation, as an alternate dispute resolution, has the potential to address legal uncertainties. The flexible and informal nature of the compulsory mediation process makes a suitable environment for all stakeholders involved, the right owners, the creators, and the users of the AI, to come to an agreement, thus lessening the impact such new invention brings to domestic legal framework. Moreover, by looking into compulsory mediations in Taiwan, the Philippines, and Turkey, this paper hopes to outline key factors for compulsory mediation to properly tackle the subject of intellectual property disputes of AI nature.","2023","2024-10-27 16:14:04","2024-10-27 16:14:04","","301-331","","2","16","","","","","","","","","","English","","","","WOS:001111303600004","","","","","","","natural language processing; machine learning; AI; AIgenerated content; Alternate dispute resolution; artificial intelligence; compulsory mediation; deficiency in law; intellectual property; IP infringement through AI; IP protection; machine learning data","","","","","","","","","","","","","","","","","","","","","","","","","","","","","","","","","","","","","","","","","","","","","","",""
"CWWAPH4S","journalArticle","2023","Yao, L","Specifics of Regulatory and Legal Regulation of Generative Artificial Intelligence in the UK, USA, EU and China","PRAVO-ZHURNAL VYSSHEI SHKOLY EKONOMIKI","","2072-8166","10.17323/2072-8166.2023.3.245.267","","On November 30, 2022, OpenAI launched ChatGPT conversational artificial intelligence; with the latest version update, ChatGPT has demonstrated an impressive ability to understand natural language, making it an attractive tool for companies and individuals looking to provide customer service and support. GPT-3 uses textual data, mostly from publicly available information on the Internet, as training data. GPT-4, on the other hand, uses a large number of images in addition to textual data for training, and thus can process both textual and graphical data. The emergence of generative AI has greatly impacted human life, but it can be said that intelligent technology is a double-edged sword:rapid development of generative artificial intelligence (AI) technologies, on the one hand, it can improve efficiency and productivity, reduce costs and open new opportunities for economic growth, but on the other hand, the use of generative AI services to create synthetic content in the form of text, audio, video and images poses possible risks. To date, different regions around the world are at different stages of development of normative acts concerning generative AI.Using the comparative legal method and the method of system analysis, this article analyzes in detail the main models of legal regulation of generative AI in the modern world on the example of the UK, the USA, the European Union and China, noting the different approach in the development and adoption of relevant normative legal acts in the field of regulation of generative AI services.It especially reveals the Chinese government's position on ""development and security"" and ""innovation and governance"" at present. The main trends of improving the regulation of generative AI services by China are proposed, and it is concluded that it is necessary to balance ""rule of law"" and ""innovation"" and promote the healthy development of generative AI.","2023","2024-10-27 16:14:04","2024-10-27 16:14:04","","245-267","","3","","","","","","","","","","","Russian","","","","WOS:001083415400011","","","","","","","regulation; Generative AI; Chat Generative Pre-TrainedTransformer, risks; foreign experience; innovations","","","","","","","","","","","","","","","","","","","","","","","","","","","","","","","","","","","","","","","","","","","","","","",""
